A1: Tous Concours confondus :
A4: 2005
B5: Inscrits | C5: Admissib. | D5: Classés | E5: Propos. | F5: Entrés | G5: Places
A6: MP | B6: 7257 | C6: 6271 | D6: 5555 | E6: 5198 | F6: 4114 | G6: 4537
A7: PC | B7: 5153 | C7: 4663 | D7: 4325 | E7: 4064 | F7: 3110 | G7: 3620
A8: PSI | B8: 4713 | C8: 4222 | D8: 3915 | E8: 3653 | F8: 2998 | G8: 3317
A9: PT | B9: 2160 | C9: 1943 | D9: 1812 | E9: 1690 | F9: 1432 | G9: 1867
A10: TSI | B10: 670 | C10: 558 | D10: 458 | E10: 407 | F10: 342 | G10: 406
A11: BCPST | B11: 2412 | C11: 1883 | D11: 1755 | E11: 1655 | F11: 1348 | G11: 1422
B12: =SUM(B6:B11) -> 22864 | C12: =SUM(C6:C11) -> 19540 | D12: =SUM(D6:D11) -> 17820 | E12: =SUM(E6:E11) -> 16667 | F12: =SUM(F6:F11) -> 13344 | G12: =SUM(G6:G11) -> 15169
A14: 2004
B15: Inscrits | C15: Admissib. | D15: Classés | E15: Propos. | F15: Entrés | G15: Places
A16: MP | B16: 7073 | C16: 6105 | D16: 5437 | E16: 5045 | F16: 3962 | G16: 4576
A17: PC | B17: 5090 | C17: 4773 | D17: 4454 | E17: 4173 | F17: 3237 | G17: 3719
A18: PSI | B18: 4313 | C18: 3964 | D18: 3673 | E18: 3474 | F18: 2841 | G18: 3283
A19: PT | B19: 2131 | C19: 1979 | D19: 1866 | E19: 1755 | F19: 1491 | G19: 1817
A20: TSI | B20: 713 | C20: 567 | D20: 467 | E20: 412 | F20: 339 | G20: 377
A21: BCPST | B21: 1768 | C21: 1495 | D21: 1388 | E21: 1337 | F21: 1150 | G21: 1211
B22: =SUM(B16:B21) -> 21088 | C22: =SUM(C16:C21) -> 18883 | D22: =SUM(D16:D21) -> 17285 | E22: =SUM(E16:E21) -> 16196 | F22: =SUM(F16:F21) -> 13020 | G22: =SUM(G16:G21) -> 14983
A24: 2003
B25: Inscrits | C25: Admissib. | D25: Classés | E25: Propos. | F25: Entrés | G25: Places
A26: MP | B26: 6989 | C26: 6197 | D26: 5529 | E26: 5066 | F26: 3953 | G26: 4511
A27: PC | B27: 5083 | C27: 4890 | D27: 4504 | E27: 4171 | F27: 3253 | G27: 3684
A28: PSI | B28: 4095 | C28: 3847 | D28: 3558 | E28: 3382 | F28: 2824 | G28: 3471
A29: PT | B29: 2105 | C29: 1968 | D29: 1870 | E29: 1772 | F29: 1563 | G29: 1849
A30: TSI | B30: 703 | C30: 577 | D30: 464 | E30: 393 | F30: 316 | G30: 380
A31: BCPST | B31: 1703 | C31: 1480 | D31: 1372 | E31: 1305 | F31: 1150 | G31: 1189
B32: =SUM(B26:B31) -> 20678 | C32: =SUM(C26:C31) -> 18959 | D32: =SUM(D26:D31) -> 17297 | E32: =SUM(E26:E31) -> 16089 | F32: =SUM(F26:F31) -> 13059 | G32: =SUM(G26:G31) -> 15084
A34: 2002
B35: Inscrits | C35: Admissib. | D35: Classés | E35: Propos. | F35: Entrés | G35: Places
A36: MP | B36: 7021 | C36: 6164 | D36: 5606 | E36: 4984 | F36: 3904 | G36: 4555
A37: PC | B37: 5106 | C37: 4762 | D37: 4446 | E37: 4089 | F37: 3140 | G37: 3752
A38: PSI | B38: 4080 | C38: 3880 | D38: 3662 | E38: 3371 | F38: 2761 | G38: 3390
A39: PT | B39: 2117 | C39: 1999 | D39: 1902 | E39: 1698 | F39: 1516 | G39: 1840
A40: TSI | B40: 722 | C40: 578 | D40: 473 | E40: 391 | F40: 319 | G40: 369
A41: BCPST | B41: 1589 | C41: 1413 | D41: 1319 | E41: 1276 | F41: 1164 | G41: 1200
B42: =SUM(B36:B41) -> 20635 | C42: =SUM(C36:C41) -> 18796 | D42: =SUM(D36:D41) -> 17408 | E42: =SUM(E36:E41) -> 15809 | F42: =SUM(F36:F41) -> 12804 | G42: =SUM(G36:G41) -> 15106
A44: 2001
B45: Inscrits | C45: Admissib. | D45: Classés | E45: Propos. | F45: Entrés | G45: Places
A46: MP | B46: 6617 | C46: 6006 | D46: 5403 | E46: 4595 | F46: 3803 | G46: 4534
A47: PC | B47: 4966 | C47: 4667 | D47: 4364 | E47: 3740 | F47: 3064 | G47: 3756
A48: PSI | B48: 3986 | C48: 3708 | D48: 3456 | E48: 3055 | F48: 2640 | G48: 3305
A49: PT | B49: 2031 | C49: 1924 | D49: 1834 | E49: 1651 | F49: 1474 | G49: 1795
A50: TSI | B50: 667 | C50: 568 | D50: 472 | E50: 367 | F50: 299 | G50: 335
B51: =SUM(B46:B50) -> 18267 | C51: =SUM(C46:C50) -> 16873 | D51: =SUM(D46:D50) -> 15529 | E51: =SUM(E46:E50) -> 13408 | F51: =SUM(F46:F50) -> 11280 | G51: =SUM(G46:G50) -> 13725
A53: 2000
B54: Inscrits | C54: Admissib. | D54: Classés | E54: Propos. | F54: Entrés | G54: Places
A55: MP | B55: 6742 | C55: 5942 | D55: 5457 | E55: 4934 | F55: 3985 | G55: 4408
A56: PC | B56: 5319 | C56: 4941 | D56: 4592 | E56: 4201 | F56: 3275 | G56: 3601
A57: PSI | B57: 4108 | C57: 3710 | D57: 3508 | E57: 3248 | F57: 2695 | G57: 3089
A58: PT | B58: 2120 | C58: 1745 | D58: 1676 | E58: 1551 | F58: 1368 | G58: 1635
A59: TSI | B59: 674 | C59: 518 | D59: 425 | E59: 362 | F59: 296 | G59: 304
B60: =SUM(B55:B59) -> 18963 | C60: =SUM(C55:C59) -> 16856 | D60: =SUM(D55:D59) -> 15658 | E60: =SUM(E55:E59) -> 14296 | F60: =SUM(F55:F59) -> 11619 | G60: =SUM(G55:G59) -> 13037
A62: 1999
B63: Inscrits | C63: Admissib. | D63: Classés | E63: Propos. | F63: Entrés | G63: Places
A64: MP | B64: 7188 | C64: 5777 | D64: 5190 | E64: 4325 | F64: 3369 | G64: 3882
A65: PC | B65: 5633 | C65: 4804 | D65: 4343 | E65: 3702 | F65: 3021 | G65: 3306
A66: PSI | B66: 4153 | C66: 3425 | D66: 3158 | E66: 2821 | F66: 2355 | G66: 2750
A67: PT | B67: 2244 | C67: 1715 | D67: 1638 | E67: 1566 | F67: 1306 | G67: 1474
A68: TSI | B68: 672 | C68: 415 | D68: 327 | E68: 283 | F68: 218 | G68: 262
B69: =SUM(B64:B68) -> 19890 | C69: =SUM(C64:C68) -> 16136 | D69: =SUM(D64:D68) -> 14656 | E69: =SUM(E64:E68) -> 12697 | F69: =SUM(F64:F68) -> 10269 | G69: =SUM(G64:G68) -> 11674