A1: Tous concours confondus :
A3: 2004
B4: Inscrits | C4: Admissib. | D4: Classés | E4: Propos. | F4: Entrés | G4: Places | H4: Rempl. | I4: Places/Insc.
A5: MP | B5: 7073 | C5: 6105 | D5: 5437 | E5: 5045 | F5: 3962 | G5: 4576 | H5: 00.87 | I5: 00.65
A6: PC | B6: 5090 | C6: 4773 | D6: 4454 | E6: 4173 | F6: 3237 | G6: 3719 | H6: 00.87 | I6: 00.78
A7: PSI | B7: 4313 | C7: 3964 | D7: 3673 | E7: 3474 | F7: 2841 | G7: 3283 | H7: 00.87 | I7: 00.76
A8: PT | B8: 2131 | C8: 1979 | D8: 1866 | E8: 1755 | F8: 1491 | G8: 1817 | H8: 00.82 | I8: 00.85
A9: TSI | B9: 713 | C9: 567 | D9: 467 | E9: 412 | F9: 339 | G9: 377 | H9: 00.9 | I9: 00.53
A10: BCPST | B10: 1768 | C10: 1495 | D10: 1388 | E10: 1337 | F10: 1150 | G10: 1211 | H10: 00.95 | I10: 00.68
B11: 21088 | C11: 18883 | D11: 17285 | E11: 16196 | F11: 13020 | G11: 14983 | H11: 00.87 | I11: 00.71
A13: 2003
B14: Inscrits | C14: Admissib. | D14: Classés | E14: Propos. | F14: Entrés | G14: Places | H14: Rempl. | I14: Places/Insc.
A15: MP | B15: 6989 | C15: 6197 | D15: 5529 | E15: 5066 | F15: 3953 | G15: 4511 | H15: =F15/G15 -> 0.87630237197960537 | I15: =G15/B15 -> 0.6454428387466018
A16: PC | B16: 5083 | C16: 4890 | D16: 4504 | E16: 4171 | F16: 3253 | G16: 3684 | H16: =F16/G16 -> 0.88300760043431048 | I16: =G16/C16 -> 0.75337423312883434
A17: PSI | B17: 4095 | C17: 3847 | D17: 3558 | E17: 3382 | F17: 2824 | G17: 3471 | H17: =F17/G17 -> 0.81359838663209449 | I17: =G17/B17 -> 0.84761904761904761
A18: PT | B18: 2105 | C18: 1968 | D18: 1870 | E18: 1772 | F18: 1563 | G18: 1849 | H18: =F18/G18 -> 0.8453217955651704 | I18: =G18/B18 -> 0.87838479809976244
A19: TSI | B19: 703 | C19: 577 | D19: 464 | E19: 393 | F19: 316 | G19: 380 | H19: =F19/G19 -> 0.83157894736842108 | I19: =G19/B19 -> 0.54054054054054057
A20: BCPST | B20: 1703 | C20: 1480 | D20: 1372 | E20: 1305 | F20: 1150 | G20: 1189 | H20: =F20/G20 -> 0.96719932716568546 | I20: =G20/B20 -> 0.69817968291250732
B21: =SUM(B15:B20) -> 20678 | C21: =SUM(C15:C20) -> 18959 | D21: =SUM(D15:D20) -> 17297 | E21: =SUM(E15:E20) -> 16089 | F21: =SUM(F15:F20) -> 13059 | G21: =SUM(G15:G20) -> 15084 | H21: =F21/G21 -> 0.86575178997613367 | I21: =G21/B21 -> 0.72947093529354867
A23: 2002
B24: Inscrits | C24: Admissib. | D24: Classés | E24: Propos. | F24: Entrés | G24: Places | H24: Rempl. | I24: Places/Insc.
A25: MP | B25: 7021 | C25: 6164 | D25: 5606 | E25: 4984 | F25: 3904 | G25: 4555 | H25: =F25/G25 -> 0.85708013172338093 | I25: =G25/B25 -> 0.64876798176897876
A26: PC | B26: 5106 | C26: 4762 | D26: 4446 | E26: 4089 | F26: 3140 | G26: 3752 | H26: =F26/G26 -> 0.83688699360341157 | I26: =G26/C26 -> 0.73482177830003914
A27: PSI | B27: 4080 | C27: 3880 | D27: 3662 | E27: 3371 | F27: 2761 | G27: 3390 | H27: =F27/G27 -> 0.81445427728613573 | I27: =G27/B27 -> 0.83088235294117652
A28: PT | B28: 2117 | C28: 1999 | D28: 1902 | E28: 1698 | F28: 1516 | G28: 1840 | H28: =F28/G28 -> 0.82391304347826089 | I28: =G28/B28 -> 0.86915446386395845
A29: TSI | B29: 722 | C29: 578 | D29: 473 | E29: 391 | F29: 319 | G29: 369 | H29: =F29/G29 -> 0.8644986449864499 | I29: =G29/B29 -> 0.5110803324099723
A30: BCPST | B30: 1589 | C30: 1413 | D30: 1319 | E30: 1276 | F30: 1164 | G30: 1200 | H30: =F30/G30 -> 00.97 | I30: =G30/B30 -> 0.75519194461925743
B31: =SUM(B25:B30) -> 21351 | C31: =SUM(C25:C30) -> 19140 | D31: =SUM(D25:D30) -> 17488 | E31: =SUM(E25:E30) -> 15809 | F31: =SUM(F25:F30) -> 12804 | G31: =SUM(G25:G30) -> 15106 | H31: =F31/G31 -> 0.84761022110419704 | I31: =G31/B31 -> 0.70750784506580489
A33: 2001
B34: Inscrits | C34: Admissib. | D34: Classés | E34: Propos. | F34: Entrés | G34: Places | H34: Rempl. | I34: Places/Insc.
A35: MP | B35: 6617 | C35: 6006 | D35: 5403 | E35: 4595 | F35: 3803 | G35: 4534 | H35: =F35/G35 -> 0.83877370974856635 | I35: =G35/B35 -> 0.68520477557805648
A36: PC | B36: 4966 | C36: 4667 | D36: 4364 | E36: 3740 | F36: 3064 | G36: 3756 | H36: =F36/G36 -> 0.81576144834930775 | I36: =G36/B36 -> 0.75634313330648406
A37: PSI | B37: 3986 | C37: 3708 | D37: 3456 | E37: 3055 | F37: 2640 | G37: 3305 | H37: =F37/G37 -> 0.79878971255673226 | I37: =G37/B37 -> 0.82915203211239341
A38: PT | B38: 2031 | C38: 1924 | D38: 1834 | E38: 1651 | F38: 1474 | G38: 1795 | H38: =F38/G38 -> 0.8211699164345404 | I38: =G38/B38 -> 0.88380108321024131
A39: TSI | B39: 667 | C39: 568 | D39: 472 | E39: 367 | F39: 299 | G39: 335 | H39: =F39/G39 -> 0.89253731343283582 | I39: =G39/B39 -> 0.50224887556221887
B40: =SUM(B35:B39) -> 18267 | C40: =SUM(C35:C39) -> 16873 | D40: =SUM(D35:D39) -> 15529 | E40: =SUM(E35:E39) -> 13408 | F40: =SUM(F35:F39) -> 11280 | G40: =SUM(G35:G39) -> 13725 | H40: =F40/G40 -> 0.82185792349726772 | I40: =G40/B40 -> 0.7513549022828051
A42: 2000
B43: Inscrits | C43: Admissib. | D43: Classés | E43: Propos. | F43: Entrés | G43: Places | H43: Rempl. | I43: Places/Insc.
A44: MP | B44: 6742 | C44: 5942 | D44: 5457 | E44: 4934 | F44: 3985 | G44: 4408 | H44: =F44/G44 -> 0.90403811252268607 | I44: =G44/B44 -> 0.65381192524473453
A45: PC | B45: 5319 | C45: 4941 | D45: 4592 | E45: 4201 | F45: 3275 | G45: 3601 | H45: =F45/G45 -> 0.90946959178006115 | I45: =G45/B45 -> 0.67700695619477347
A46: PSI | B46: 4108 | C46: 3710 | D46: 3508 | E46: 3248 | F46: 2695 | G46: 3089 | H46: =F46/G46 -> 0.87245063127225642 | I46: =G46/B46 -> 0.75194741966893863
A47: PT | B47: 2120 | C47: 1745 | D47: 1676 | E47: 1551 | F47: 1368 | G47: 1635 | H47: =F47/G47 -> 0.83669724770642206 | I47: =G47/B47 -> 0.77122641509433965
A48: TSI | B48: 674 | C48: 518 | D48: 425 | E48: 362 | F48: 296 | G48: 304 | H48: =F48/G48 -> 0.97368421052631582 | I48: =G48/B48 -> 0.45103857566765576
B49: =SUM(B44:B48) -> 18963 | C49: =SUM(C44:C48) -> 16856 | D49: =SUM(D44:D48) -> 15658 | E49: =SUM(E44:E48) -> 14296 | F49: =SUM(F44:F48) -> 11619 | G49: =SUM(G44:G48) -> 13037 | H49: =F49/G49 -> 0.89123264554728854 | I49: =G49/B49 -> 0.68749670410799979
A51: 1999
B52: Inscrits | C52: Admissib. | D52: Classés | E52: Propos. | F52: Entrés | G52: Places | H52: Rempl. | I52: Places/Insc.
A53: MP | B53: 7188 | C53: 5777 | D53: 5190 | E53: 4325 | F53: 3369 | G53: 3882 | H53: =F53/G53 -> 0.86785162287480677 | I53: =G53/B53 -> 0.54006677796327207
A54: PC | B54: 5633 | C54: 4804 | D54: 4343 | E54: 3702 | F54: 3021 | G54: 3306 | H54: =F54/G54 -> 0.91379310344827591 | I54: =G54/B54 -> 0.58689863305521039
A55: PSI | B55: 4153 | C55: 3425 | D55: 3158 | E55: 2821 | F55: 2355 | G55: 2750 | H55: =F55/G55 -> 0.85636363636363633 | I55: =G55/B55 -> 0.66217192391042623
A56: PT | B56: 2244 | C56: 1715 | D56: 1638 | E56: 1566 | F56: 1306 | G56: 1474 | H56: =F56/G56 -> 0.88602442333785614 | I56: =G56/B56 -> 0.65686274509803921
A57: TSI | B57: 672 | C57: 415 | D57: 327 | E57: 283 | F57: 218 | G57: 262 | H57: =F57/G57 -> 0.83206106870229013 | I57: =G57/B57 -> 0.38988095238095238
B58: =SUM(B53:B57) -> 19890 | C58: =SUM(C53:C57) -> 16136 | D58: =SUM(D53:D57) -> 14656 | E58: =SUM(E53:E57) -> 12697 | F58: =SUM(F53:F57) -> 10269 | G58: =SUM(G53:G57) -> 11674 | H58: =F58/G58 -> 0.87964707897892758 | I58: =G58/B58 -> 0.58692810457516342