A1: Tous Concours confondus :
A4: 2006
B5: Inscrits | C5: Admissib. | D5: Classés | E5: Propos. | F5: Entrés | G5: Places | H5: Rempl. | I5: Places/Insc.
A6: MP | B6: 7493 | C6: 6423 | D6: 5665 | E6: 5318 | F6: 4164 | G6: 4515 | H6: =F6/G6 -> 0.92225913621262456 | I6: =G6/B6 -> 0.6025623915654611
A7: PC | B7: 5189 | C7: 4705 | D7: 4339 | E7: 4098 | F7: 3195 | G7: 3556 | H7: =F7/G7 -> 0.89848143982002249 | I7: =G7/B7 -> 0.6852958180767007
A8: PSI | B8: 4938 | C8: 4420 | D8: 4068 | E8: 3820 | F8: 3068 | G8: 3367 | H8: =F8/G8 -> 0.91119691119691115 | I8: =G8/B8 -> 0.6818550020251114
A9: PT | B9: 2244 | C9: 2035 | D9: 1923 | E9: 1800 | F9: 1507 | G9: 1810 | H9: =F9/G9 -> 0.83259668508287288 | I9: =G9/B9 -> 0.80659536541889487
A10: TSI | B10: 724 | C10: 629 | D10: 521 | E10: 460 | F10: 368 | G10: 422 | H10: =F10/G10 -> 0.87203791469194314 | I10: =G10/B10 -> 0.58287292817679559
A11: BCPST | B11: 2694 | C11: 2186 | D11: 2036 | E11: 1964 | F11: 1604 | G11: 1669 | H11: =F11/G11 -> 0.96105452366686639 | I11: =G11/B11 -> 0.6195248700816629
B12: =SUM(B6:B11) -> 23282 | C12: =SUM(C6:C11) -> 20398 | D12: =SUM(D6:D11) -> 18552 | E12: =SUM(E6:E11) -> 17460 | F12: =SUM(F6:F11) -> 13906 | G12: =SUM(G6:G11) -> 15339 | H12: =F12/G12 -> 0.90657800378121134 | I12: =G12/B12 -> 0.65883515161927675
A14: 2005
B15: Inscrits | C15: Admissib. | D15: Classés | E15: Propos. | F15: Entrés | G15: Places | H15: Rempl. | I15: Places/Insc.
A16: MP | B16: 7257 | C16: 6271 | D16: 5555 | E16: 5198 | F16: 4114 | G16: 4537 | H16: =F16/G16 -> 0.9067665858496804 | I16: =G16/B16 -> 0.62518947223370536
A17: PC | B17: 5153 | C17: 4663 | D17: 4325 | E17: 4064 | F17: 3110 | G17: 3620 | H17: =F17/G17 -> 0.85911602209944748 | I17: =G17/B17 -> 0.70250339607995338
A18: PSI | B18: 4713 | C18: 4222 | D18: 3915 | E18: 3653 | F18: 2998 | G18: 3317 | H18: =F18/G18 -> 0.90382876092854991 | I18: =G18/B18 -> 0.70379800551665606
A19: PT | B19: 2160 | C19: 1943 | D19: 1812 | E19: 1690 | F19: 1432 | G19: 1867 | H19: =F19/G19 -> 0.76700589180503487 | I19: =G19/B19 -> 0.70214366303121478
A20: TSI | B20: 670 | C20: 558 | D20: 458 | E20: 407 | F20: 342 | G20: 406 | H20: =F20/G20 -> 0.8423645320197044 | I20: =G20/B20 -> 0.60597014925373138
A21: BCPST | B21: 2412 | C21: 1883 | D21: 1755 | E21: 1655 | F21: 1348 | G21: 1422 | H21: =F21/G21 -> 0.9479606188466948 | I21: =G21/B21 -> 0.58955223880597019
B22: =SUM(B16:B21) -> 22864 | C22: =SUM(C16:C21) -> 19540 | D22: =SUM(D16:D21) -> 17820 | E22: =SUM(E16:E21) -> 16667 | F22: =SUM(F16:F21) -> 13344 | G22: =SUM(G16:G21) -> 15169 | H22: =F22/G22 -> 0.87968883907970208 | I22: =G22/B22 -> 0.66344471658502446
A24: 2004
B25: Inscrits | C25: Admissib. | D25: Classés | E25: Propos. | F25: Entrés | G25: Places | H25: Rempl. | I25: Places/Insc.
A26: MP | B26: 7073 | C26: 6105 | D26: 5437 | E26: 5045 | F26: 3962 | G26: 4576 | H26: =F26/G26 -> 0.86582167832167833 | I26: =G26/B26 -> 0.64696734059097982
A27: PC | B27: 5090 | C27: 4773 | D27: 4454 | E27: 4173 | F27: 3237 | G27: 3719 | H27: =F27/G27 -> 0.87039526754503904 | I27: =G27/B27 -> 0.73064833005893914
A28: PSI | B28: 4313 | C28: 3964 | D28: 3673 | E28: 3474 | F28: 2841 | G28: 3283 | H28: =F28/G28 -> 0.86536704233932382 | I28: =G28/B28 -> 0.76118710874101558
A29: PT | B29: 2131 | C29: 1979 | D29: 1866 | E29: 1755 | F29: 1491 | G29: 1817 | H29: =F29/G29 -> 0.82058337919647772 | I29: =G29/B29 -> 0.85265133740028154
A30: TSI | B30: 713 | C30: 567 | D30: 467 | E30: 412 | F30: 339 | G30: 377 | H30: =F30/G30 -> 0.89920424403183019 | I30: =G30/B30 -> 0.52875175315568024
A31: BCPST | B31: 1768 | C31: 1495 | D31: 1388 | E31: 1337 | F31: 1150 | G31: 1211 | H31: =F31/G31 -> 0.94962840627580514 | I31: =G31/B31 -> 0.68495475113122173
B32: =SUM(B26:B31) -> 21088 | C32: =SUM(C26:C31) -> 18883 | D32: =SUM(D26:D31) -> 17285 | E32: =SUM(E26:E31) -> 16196 | F32: =SUM(F26:F31) -> 13020 | G32: =SUM(G26:G31) -> 14983 | H32: =F32/G32 -> 0.86898484949609556 | I32: =G32/B32 -> 0.71049886191198786
A34: 2003
B35: Inscrits | C35: Admissib. | D35: Classés | E35: Propos. | F35: Entrés | G35: Places | H35: Rempl. | I35: Places/Insc.
A36: MP | B36: 6989 | C36: 6197 | D36: 5529 | E36: 5066 | F36: 3953 | G36: 4511 | H36: =F36/G36 -> 0.87630237197960537 | I36: =G36/B36 -> 0.6454428387466018
A37: PC | B37: 5083 | C37: 4890 | D37: 4504 | E37: 4171 | F37: 3253 | G37: 3684 | H37: =F37/G37 -> 0.88300760043431048 | I37: =G37/B37 -> 0.72476883730080666
A38: PSI | B38: 4095 | C38: 3847 | D38: 3558 | E38: 3382 | F38: 2824 | G38: 3471 | H38: =F38/G38 -> 0.81359838663209449 | I38: =G38/B38 -> 0.84761904761904761
A39: PT | B39: 2105 | C39: 1968 | D39: 1870 | E39: 1772 | F39: 1563 | G39: 1849 | H39: =F39/G39 -> 0.8453217955651704 | I39: =G39/B39 -> 0.87838479809976244
A40: TSI | B40: 703 | C40: 577 | D40: 464 | E40: 393 | F40: 316 | G40: 380 | H40: =F40/G40 -> 0.83157894736842108 | I40: =G40/B40 -> 0.54054054054054057
A41: BCPST | B41: 1703 | C41: 1480 | D41: 1372 | E41: 1305 | F41: 1150 | G41: 1189 | H41: =F41/G41 -> 0.96719932716568546 | I41: =G41/B41 -> 0.69817968291250732
B42: =SUM(B36:B41) -> 20678 | C42: =SUM(C36:C41) -> 18959 | D42: =SUM(D36:D41) -> 17297 | E42: =SUM(E36:E41) -> 16089 | F42: =SUM(F36:F41) -> 13059 | G42: =SUM(G36:G41) -> 15084 | H42: =F42/G42 -> 0.86575178997613367 | I42: =G42/B42 -> 0.72947093529354867
A44: 2002
B45: Inscrits | C45: Admissib. | D45: Classés | E45: Propos. | F45: Entrés | G45: Places | H45: Rempl. | I45: Places/Insc.
A46: MP | B46: 7021 | C46: 6164 | D46: 5606 | E46: 4984 | F46: 3904 | G46: 4555 | H46: =F46/G46 -> 0.85708013172338093 | I46: =G46/B46 -> 0.64876798176897876
A47: PC | B47: 5106 | C47: 4762 | D47: 4446 | E47: 4089 | F47: 3140 | G47: 3752 | H47: =F47/G47 -> 0.83688699360341157 | I47: =G47/B47 -> 0.73482177830003914
A48: PSI | B48: 4080 | C48: 3880 | D48: 3662 | E48: 3371 | F48: 2761 | G48: 3390 | H48: =F48/G48 -> 0.81445427728613573 | I48: =G48/B48 -> 0.83088235294117652
A49: PT | B49: 2117 | C49: 1999 | D49: 1902 | E49: 1698 | F49: 1516 | G49: 1840 | H49: =F49/G49 -> 0.82391304347826089 | I49: =G49/B49 -> 0.86915446386395845
A50: TSI | B50: 722 | C50: 578 | D50: 473 | E50: 391 | F50: 319 | G50: 369 | H50: =F50/G50 -> 0.8644986449864499 | I50: =G50/B50 -> 0.5110803324099723
A51: BCPST | B51: 1589 | C51: 1413 | D51: 1319 | E51: 1276 | F51: 1164 | G51: 1200 | H51: =F51/G51 -> 00.97 | I51: =G51/B51 -> 0.75519194461925743
B52: =SUM(B46:B51) -> 20635 | C52: =SUM(C46:C51) -> 18796 | D52: =SUM(D46:D51) -> 17408 | E52: =SUM(E46:E51) -> 15809 | F52: =SUM(F46:F51) -> 12804 | G52: =SUM(G46:G51) -> 15106 | H52: =F52/G52 -> 0.84761022110419704 | I52: =G52/B52 -> 0.73205718439544465
A54: 2001
B55: Inscrits | C55: Admissib. | D55: Classés | E55: Propos. | F55: Entrés | G55: Places | H55: Rempl. | I55: Places/Insc.
A56: MP | B56: 6617 | C56: 6006 | D56: 5403 | E56: 4595 | F56: 3803 | G56: 4534 | H56: =F56/G56 -> 0.83877370974856635 | I56: =G56/B56 -> 0.68520477557805648
A57: PC | B57: 4966 | C57: 4667 | D57: 4364 | E57: 3740 | F57: 3064 | G57: 3756 | H57: =F57/G57 -> 0.81576144834930775 | I57: =G57/B57 -> 0.75634313330648406
A58: PSI | B58: 3986 | C58: 3708 | D58: 3456 | E58: 3055 | F58: 2640 | G58: 3305 | H58: =F58/G58 -> 0.79878971255673226 | I58: =G58/B58 -> 0.82915203211239341
A59: PT | B59: 2031 | C59: 1924 | D59: 1834 | E59: 1651 | F59: 1474 | G59: 1795 | H59: =F59/G59 -> 0.8211699164345404 | I59: =G59/B59 -> 0.88380108321024131
A60: TSI | B60: 667 | C60: 568 | D60: 472 | E60: 367 | F60: 299 | G60: 335 | H60: =F60/G60 -> 0.89253731343283582 | I60: =G60/B60 -> 0.50224887556221887
B61: =SUM(B56:B60) -> 18267 | C61: =SUM(C56:C60) -> 16873 | D61: =SUM(D56:D60) -> 15529 | E61: =SUM(E56:E60) -> 13408 | F61: =SUM(F56:F60) -> 11280 | G61: =SUM(G56:G60) -> 13725 | H61: =F61/G61 -> 0.82185792349726772 | I61: =G61/B61 -> 0.7513549022828051
A63: 2000
B64: Inscrits | C64: Admissib. | D64: Classés | E64: Propos. | F64: Entrés | G64: Places | H64: Rempl. | I64: Places/Insc.
A65: MP | B65: 6742 | C65: 5942 | D65: 5457 | E65: 4934 | F65: 3985 | G65: 4408 | H65: =F65/G65 -> 0.90403811252268607 | I65: =G65/B65 -> 0.65381192524473453
A66: PC | B66: 5319 | C66: 4941 | D66: 4592 | E66: 4201 | F66: 3275 | G66: 3601 | H66: =F66/G66 -> 0.90946959178006115 | I66: =G66/B66 -> 0.67700695619477347
A67: PSI | B67: 4108 | C67: 3710 | D67: 3508 | E67: 3248 | F67: 2695 | G67: 3089 | H67: =F67/G67 -> 0.87245063127225642 | I67: =G67/B67 -> 0.75194741966893863
A68: PT | B68: 2120 | C68: 1745 | D68: 1676 | E68: 1551 | F68: 1368 | G68: 1635 | H68: =F68/G68 -> 0.83669724770642206 | I68: =G68/B68 -> 0.77122641509433965
A69: TSI | B69: 674 | C69: 518 | D69: 425 | E69: 362 | F69: 296 | G69: 304 | H69: =F69/G69 -> 0.97368421052631582 | I69: =G69/B69 -> 0.45103857566765576
B70: =SUM(B65:B69) -> 18963 | C70: =SUM(C65:C69) -> 16856 | D70: =SUM(D65:D69) -> 15658 | E70: =SUM(E65:E69) -> 14296 | F70: =SUM(F65:F69) -> 11619 | G70: =SUM(G65:G69) -> 13037 | H70: =F70/G70 -> 0.89123264554728854 | I70: =G70/B70 -> 0.68749670410799979
A72: 1999
B73: Inscrits | C73: Admissib. | D73: Classés | E73: Propos. | F73: Entrés | G73: Places | H73: Rempl. | I73: Places/Insc.
A74: MP | B74: 7188 | C74: 5777 | D74: 5190 | E74: 4325 | F74: 3369 | G74: 3882 | H74: =F74/G74 -> 0.86785162287480677 | I74: =G74/B74 -> 0.54006677796327207
A75: PC | B75: 5633 | C75: 4804 | D75: 4343 | E75: 3702 | F75: 3021 | G75: 3306 | H75: =F75/G75 -> 0.91379310344827591 | I75: =G75/B75 -> 0.58689863305521039
A76: PSI | B76: 4153 | C76: 3425 | D76: 3158 | E76: 2821 | F76: 2355 | G76: 2750 | H76: =F76/G76 -> 0.85636363636363633 | I76: =G76/B76 -> 0.66217192391042623
A77: PT | B77: 2244 | C77: 1715 | D77: 1638 | E77: 1566 | F77: 1306 | G77: 1474 | H77: =F77/G77 -> 0.88602442333785614 | I77: =G77/B77 -> 0.65686274509803921
A78: TSI | B78: 672 | C78: 415 | D78: 327 | E78: 283 | F78: 218 | G78: 262 | H78: =F78/G78 -> 0.83206106870229013 | I78: =G78/B78 -> 0.38988095238095238
B79: =SUM(B74:B78) -> 19890 | C79: =SUM(C74:C78) -> 16136 | D79: =SUM(D74:D78) -> 14656 | E79: =SUM(E74:E78) -> 12697 | F79: =SUM(F74:F78) -> 10269 | G79: =SUM(G74:G78) -> 11674 | H79: =F79/G79 -> 0.87964707897892758 | I79: =G79/B79 -> 0.58692810457516342